[
  {
    "identity": "UNDERSTANDING-PHY-001",
    "definition": "Understanding a physics term well enough to state it in the elements the marking guidelines reward - the quantity being related, the relation, and the qualifying condition - rather than as a loose synonym.",
    "subject": "physics",
    "grade": "11",
    "topic": "Physics terminology and laws (cross-topic)",
    "question_family": "QUESTION-FAMILY-PHY-001",
    "assessment_operations": [
      "recall a definition",
      "state a law",
      "explain a term"
    ],
    "required_knowledge": [
      "the exact definitional elements for the recurring terms: velocity, acceleration, displacement, speed, friction, normal force, resultant force, work, power, potential difference, emf, resistance, ohmic conductor, diode, knee voltage, gravitational field, impulse",
      "the three Newton's laws as statements, including 'net or resultant force' in the first law and 'at constant temperature' in Ohm's law",
      "the work-energy theorem and conservation of linear momentum as worded statements"
    ],
    "prerequisites": [
      "scalar vs vector distinction (needed for velocity, displacement and resultant force)",
      "the idea of a 'net' force as distinct from any single force"
    ],
    "required_reasoning": [
      "identify which two elements the question's term decomposes into",
      "recognise that a definition of a rate must name both the quantity and what it is per (rate of change of position, work per unit charge, force per unit mass)"
    ],
    "required_procedure": null,
    "evidence_of_understanding": [
      "states both required elements without prompting (e.g. friction: opposes motion AND parallel to the contact surface)",
      "includes the qualifying condition where the memo requires it (Ohm's law 'at constant temperature'; conservation of momentum 'of an isolated system'; maximum static friction 'of a stationary object')",
      "can distinguish the term from a neighbouring one (speed vs velocity, distance vs displacement, mass vs weight)"
    ],
    "marking_requirements": [
      "the memo splits every definition into two separately ticked elements; one correct idea alone earns 1 of 2 marks",
      "several memos annotate 'AON' (any other correct wording accepted), so paraphrase is acceptable if both elements are present",
      "Newton's first law is marked as 'state of rest or uniform velocity' + 'unless acted on by a net or resultant force'",
      "the work-energy theorem is marked as 'work done by a net force' + 'equals change in kinetic energy' - omitting 'net' loses a mark"
    ],
    "common_breakdowns": [
      "BREAKDOWN-PHY-001-A",
      "BREAKDOWN-PHY-001-B",
      "BREAKDOWN-PHY-001-C"
    ],
    "misconceptions": [
      "[Tier 3 inference] 'velocity and speed are the same thing' - would lose the vector element the memo requires for velocity",
      "[Tier 3 inference] 'friction always opposes the direction the object is moving' - the memo requires 'parallel to the surface', which is what makes the incline items work",
      "[Tier 3 inference] 'Ohm's law holds for any component at any time' - the memo's 'constant temperature' element is precisely what this misses"
    ],
    "diagnostic_dimensions": [
      "recall",
      "precision of wording",
      "conceptual boundary"
    ],
    "diagnostic_questions": [
      "DIAG-PHY-001-A",
      "DIAG-PHY-001-B",
      "DIAG-PHY-001-C"
    ],
    "source_references": [
      "physics_2019_internal_paper1_june_q2.1.1",
      "physics_2019_internal_paper1_june_q3.1.1",
      "physics_2019_internal_paper1_june_q4.1.1",
      "physics_2019_internal_paper1_june_q4.2.1",
      "physics_2019_internal_paper1_june_q5.1",
      "physics_2019_internal_paper1_june_q5.2",
      "physics_2019_internal_paper1_june_q7.1",
      "physics_2019_internal_paper1_june_q7.3",
      "physics_2021_internal_paper1_nov_q2.1.2",
      "physics_2021_internal_paper1_nov_q3.1",
      "physics_2021_internal_paper1_nov_q4.3.1",
      "physics_2021_internal_paper1_nov_q5.2",
      "physics_2021_internal_paper1_nov_q5.4",
      "physics_2021_internal_paper1_nov_q6.1.1",
      "physics_2021_internal_paper1_nov_q6.2.3",
      "physics_2021_internal_paper1_nov_q7.1.1",
      "physics_2021_internal_paper1_nov_q7.2.1",
      "physics_2023_internal_paper1_june_q2.1",
      "physics_2023_internal_paper1_june_q3.1",
      "physics_2023_internal_paper1_june_q5.1",
      "physics_2023_internal_paper1_june_q6.1",
      "physics_2023_internal_paper1_june_q7.1.2",
      "physics_2023_internal_paper1_june_q7.2.1",
      "physics_2023_internal_paper1_june_q8.1",
      "physics_2023_internal_paper1_june_q8.3",
      "physics_2023_internal_paper1_june_q8.5",
      "physics_2023_internal_paper1_june_q9.1",
      "physics_2023_internal_paper1_june_q9.2",
      "physics_2023_internal_paper1_june_q4.1",
      "physics_2025_internal_paper1_nov_q1.1.1",
      "physics_2025_internal_paper1_nov_q2.1",
      "physics_2025_internal_paper1_nov_q3.2",
      "physics_2025_internal_paper1_nov_q4.5",
      "physics_2025_internal_paper1_nov_q5.1",
      "physics_2025_internal_paper1_nov_q5.4",
      "physics_2025_internal_paper1_nov_q6.1.1",
      "physics_2025_internal_paper1_nov_q9.1"
    ],
    "provenance": [
      "UNDERSTANDING-PHY-001 (Understanding Model, Tier 2/3)",
      "QUESTION-FAMILY-PHY-001 (question family, Tier 2)",
      "37 question records across 4 papers: PHY-2019-MY, PHY-2021-NOV, PHY-2023-MY, PHY-2025-NOV",
      "marking memoranda: G11 -  MG - Physics Final Exam - Nov - 2025.pdf, G11- Mid-Year Examination - MG FINAL - 2023.pdf, Grade 11 Paper 1 MG 2019.pdf, PS11 Physics November Exam 2021 MG.pdf",
      "source documents: G11 -  QP - Physics Final Exam - Nov - 2025.pdf, G11- Mid-Year Examination - QP - 2023.pdf, Grade 11 Paper 1 QP 2019.pdf, PS11 Physics November Exam 2021 QP.pdf",
      "ORC source inventory: data/raw/physics/SOURCE_INVENTORY.yaml (mapping to SOURCE-* ids pending)"
    ],
    "confidence": "high",
    "validation_state": "unvalidated",
    "version": "0.1.0-draft"
  },
  {
    "identity": "UNDERSTANDING-PHY-002",
    "definition": "Understanding how to turn a described motion or force situation into one equation from the data sheet, substitute with a consistent sign convention and units, and report a physically sensible value.",
    "subject": "physics",
    "grade": "11",
    "topic": "Mechanics: motion, forces and energy calculations",
    "question_family": "QUESTION-FAMILY-PHY-002",
    "assessment_operations": [
      "select an equation",
      "substitute",
      "calculate",
      "state a value with units"
    ],
    "required_knowledge": [
      "the equations of motion (v = u + at, v2 = u2 + 2as, s = ut + 1/2 at2, s = ((u+v)/2)t)",
      "Fnet = ma, Ff = mu FN, Fg = mg, W = Fx cos theta, Ek = 1/2 mv2, Wnet = dEk",
      "that g = 9,8 m.s-2 and that upward/forward must be declared positive before substituting"
    ],
    "prerequisites": [
      "UNDERSTANDING-PHY-001 (definitions of velocity, acceleration, work)",
      "algebraic rearrangement of a formula before substitution",
      "unit conversion (minutes to seconds, km.h-1 to m.s-1, ms to s)"
    ],
    "required_reasoning": [
      "decide which quantity is unknown and which equation contains exactly the knowns given",
      "hold one sign convention across a multi-stage problem (the memo marks a missing negative sign separately)",
      "recognise when a two-stage problem must be split (cliff height first, then height above the cliff; two legs of a journey summed)"
    ],
    "required_procedure": "write the equation -> substitute with signs and units -> solve -> state the answer with a unit and, where the paper asks, to two decimal places",
    "evidence_of_understanding": [
      "names the equation before substituting rather than producing a bare number",
      "keeps the same sign convention in every line and can explain why a term is negative",
      "checks the answer for physical reasonableness (a braking acceleration must oppose the motion; a time must be positive)",
      "can say what each symbol stands for in the chosen equation"
    ],
    "marking_requirements": [
      "memos award a separate mark for the equation, the substitution and the final answer - the method mark survives a substitution error",
      "2019 memo (2.2.3): 'Must show that the acceleration is negative' - the sign is a mark",
      "2021 memo (4.3.2) marks the negative sign explicitly; 2025 memo (2.2) marks 'e&s' (equation and substitution) separately",
      "later parts are marked 'coe'/'COE' from an earlier answer, so a wrong earlier value does not zero the later method marks",
      "where the paper says 'show all your working out' (2023 Q7.2.4) the derivation itself is marked, not only the result"
    ],
    "common_breakdowns": [
      "BREAKDOWN-PHY-002-A",
      "BREAKDOWN-PHY-002-B",
      "BREAKDOWN-PHY-002-C",
      "BREAKDOWN-PHY-002-D"
    ],
    "misconceptions": [
      "[Tier 3 inference] 'acceleration and velocity always have the same sign' - produces the wrong sign in braking and upward-motion items the memo marks separately",
      "[Tier 3 inference] 'the equation with the most familiar symbols is the right one' - produces v = u + at where v2 = u2 + 2as is required (no time given)",
      "[memo-evidenced] 2023 memo (2.6.3) requires time in seconds (600 s, not 10 minutes): unit conversion is a live failure point"
    ],
    "diagnostic_dimensions": [
      "interpretation",
      "prerequisite",
      "strategy",
      "execution",
      "verification"
    ],
    "diagnostic_questions": [
      "DIAG-PHY-002-A",
      "DIAG-PHY-002-B",
      "DIAG-PHY-002-C"
    ],
    "source_references": [
      "physics_2019_internal_paper1_june_q2.1.3",
      "physics_2019_internal_paper1_june_q2.1.4",
      "physics_2019_internal_paper1_june_q2.1.5",
      "physics_2019_internal_paper1_june_q2.2.2",